{
  "schema_version": "1.0",
  "sample_id": "sample_0255",
  "status": "ok",
  "function": {
    "name": "FUN_00401156",
    "entry": "0x401156",
    "size_bytes": 153,
    "instruction_count": 39,
    "basic_block_count": 6,
    "body_ranges": [
      [
        "0x401156",
        "0x4011ef"
      ]
    ]
  },
  "decompilation": {
    "status": "ok",
    "text": "\nvoid FUN_00401156(void)\n\n{\n  undefined1 local_48 [16];\n  undefined1 local_38 [16];\n  undefined8 local_28;\n  uint *local_18;\n  ulong local_10;\n  \n  local_18 = (uint *)0x0;\n  local_18 = malloc(0x28);\n  if (local_18 == (uint *)0x0) {\n                    /* WARNING: Subroutine does not return */\n    exit(-1);\n  }\n  local_48 = (undefined1  [16])0x0;\n  local_38 = (undefined1  [16])0x0;\n  local_28 = 0;\n  for (local_10 = 0; local_10 < 10; local_10 = local_10 + 1) {\n    local_18[local_10] = *(uint *)(local_48 + local_10 * 4);\n  }\n  printf(\"%d\\n\",(ulong)*local_18);\n  free(local_18);\n  return;\n}\n\n",
    "error": null
  },
  "instructions": [
    "0x401156: PUSH RBP",
    "0x401157: MOV RBP,RSP",
    "0x40115a: SUB RSP,0x40",
    "0x40115e: MOV qword ptr [RBP + -0x10],0x0",
    "0x401166: MOV EDI,0x28",
    "0x40116b: CALL 0x00401050",
    "0x401170: MOV qword ptr [RBP + -0x10],RAX",
    "0x401174: CMP qword ptr [RBP + -0x10],0x0",
    "0x401179: JNZ 0x00401185",
    "0x40117b: MOV EDI,0xffffffff",
    "0x401180: CALL 0x00401060",
    "0x401185: PXOR XMM0,XMM0",
    "0x401189: MOVAPS xmmword ptr [RBP + -0x40],XMM0",
    "0x40118d: MOVAPS xmmword ptr [RBP + -0x30],XMM0",
    "0x401191: MOVQ qword ptr [RBP + -0x20],XMM0",
    "0x401196: MOV qword ptr [RBP + -0x8],0x0",
    "0x40119e: JMP 0x004011c2",
    "0x4011a0: MOV RAX,qword ptr [RBP + -0x8]",
    "0x4011a4: LEA RDX,[RAX*0x4]",
    "0x4011ac: MOV RAX,qword ptr [RBP + -0x10]",
    "0x4011b0: ADD RDX,RAX",
    "0x4011b3: MOV RAX,qword ptr [RBP + -0x8]",
    "0x4011b7: MOV EAX,dword ptr [RBP + RAX*0x4 + -0x40]",
    "0x4011bb: MOV dword ptr [RDX],EAX",
    "0x4011bd: ADD qword ptr [RBP + -0x8],0x1",
    "0x4011c2: CMP qword ptr [RBP + -0x8],0x9",
    "0x4011c7: JBE 0x004011a0",
    "0x4011c9: MOV RAX,qword ptr [RBP + -0x10]",
    "0x4011cd: MOV EAX,dword ptr [RAX]",
    "0x4011cf: MOV ESI,EAX",
    "0x4011d1: MOV EDI,0x402004",
    "0x4011d6: MOV EAX,0x0",
    "0x4011db: CALL 0x00401040",
    "0x4011e0: MOV RAX,qword ptr [RBP + -0x10]",
    "0x4011e4: MOV RDI,RAX",
    "0x4011e7: CALL 0x00401030",
    "0x4011ec: NOP",
    "0x4011ed: LEAVE",
    "0x4011ee: RET"
  ],
  "calls": [
    "malloc",
    "exit",
    "printf",
    "free"
  ],
  "tail_jumps": [],
  "constants": [
    "64",
    "0",
    "40",
    "-1",
    "1",
    "9"
  ],
  "stack_variables": [
    {
      "name": "local_48",
      "stack_offset": -72,
      "size_bytes": 16,
      "data_type": "undefined1[16]"
    },
    {
      "name": "local_38",
      "stack_offset": -56,
      "size_bytes": 16,
      "data_type": "undefined1[16]"
    },
    {
      "name": "local_28",
      "stack_offset": -40,
      "size_bytes": 8,
      "data_type": "undefined8"
    },
    {
      "name": "local_18",
      "stack_offset": -24,
      "size_bytes": 8,
      "data_type": "undefined8"
    },
    {
      "name": "local_10",
      "stack_offset": -16,
      "size_bytes": 8,
      "data_type": "undefined8"
    }
  ],
  "imports": [
    "malloc",
    "exit",
    "printf",
    "free"
  ]
}
