{
  "schema_version": "1.0",
  "sample_id": "sample_0106",
  "status": "ok",
  "function": {
    "name": "FUN_00401146",
    "entry": "0x401146",
    "size_bytes": 348,
    "instruction_count": 89,
    "basic_block_count": 11,
    "body_ranges": [
      [
        "0x401146",
        "0x4012a2"
      ]
    ]
  },
  "decompilation": {
    "status": "ok",
    "text": "\nvoid FUN_00401146(void)\n\n{\n  char *pcVar1;\n  undefined1 *puVar2;\n  char local_88 [99];\n  undefined1 local_25;\n  char *local_20;\n  ulong local_18;\n  char *local_10;\n  \n  for (pcVar1 = local_88; pcVar1 != local_88; pcVar1 = pcVar1 + -0x1000) {\n    *(undefined8 *)(pcVar1 + -8) = *(undefined8 *)(pcVar1 + -8);\n  }\n  *(undefined8 *)(pcVar1 + -8) = *(undefined8 *)(pcVar1 + -8);\n  local_20 = (char *)((ulong)(pcVar1 + -0x31) & 0xfffffffffffffff0);\n  local_10 = local_20;\n  for (puVar2 = pcVar1 + -0x40; puVar2 != pcVar1 + -0x40; puVar2 = puVar2 + -0x1000) {\n    *(undefined8 *)(puVar2 + -8) = *(undefined8 *)(puVar2 + -8);\n  }\n  *(undefined8 *)(puVar2 + -8) = *(undefined8 *)(puVar2 + -8);\n  local_18 = (ulong)(puVar2 + -0x61) & 0xfffffffffffffff0;\n  *local_20 = '\\0';\n  *(undefined8 *)(puVar2 + -0x78) = 0x401277;\n  memset(local_88,0x43,99);\n  local_25 = 0;\n  *(undefined8 *)(puVar2 + -0x78) = 0x401293;\n  strncat(local_20,local_88,100);\n  *(undefined8 *)(puVar2 + -0x78) = 0x40129f;\n  puts(local_20);\n  return;\n}\n\n",
    "error": null
  },
  "instructions": [
    "0x401146: PUSH RBP",
    "0x401147: MOV RBP,RSP",
    "0x40114a: ADD RSP,-0x80",
    "0x40114e: MOV EAX,0x10",
    "0x401153: SUB RAX,0x1",
    "0x401157: ADD RAX,0x3a",
    "0x40115b: MOV ESI,0x10",
    "0x401160: MOV EDX,0x0",
    "0x401165: DIV RSI",
    "0x401168: IMUL RAX,RAX,0x10",
    "0x40116c: MOV RCX,RAX",
    "0x40116f: AND RCX,-0x1000",
    "0x401176: MOV RDX,RSP",
    "0x401179: SUB RDX,RCX",
    "0x40117c: CMP RSP,RDX",
    "0x40117f: JZ 0x00401193",
    "0x401181: SUB RSP,0x1000",
    "0x401188: OR qword ptr [RSP + 0xff8],0x0",
    "0x401191: JMP 0x0040117c",
    "0x401193: MOV RDX,RAX",
    "0x401196: AND EDX,0xfff",
    "0x40119c: SUB RSP,RDX",
    "0x40119f: MOV RDX,RAX",
    "0x4011a2: AND EDX,0xfff",
    "0x4011a8: TEST RDX,RDX",
    "0x4011ab: JZ 0x004011bd",
    "0x4011ad: AND EAX,0xfff",
    "0x4011b2: SUB RAX,0x8",
    "0x4011b6: ADD RAX,RSP",
    "0x4011b9: OR qword ptr [RAX],0x0",
    "0x4011bd: MOV RAX,RSP",
    "0x4011c0: ADD RAX,0xf",
    "0x4011c4: SHR RAX,0x4",
    "0x4011c8: SHL RAX,0x4",
    "0x4011cc: MOV qword ptr [RBP + -0x8],RAX",
    "0x4011d0: MOV EAX,0x10",
    "0x4011d5: SUB RAX,0x1",
    "0x4011d9: ADD RAX,0x6c",
    "0x4011dd: MOV EDI,0x10",
    "0x4011e2: MOV EDX,0x0",
    "0x4011e7: DIV RDI",
    "0x4011ea: IMUL RAX,RAX,0x10",
    "0x4011ee: MOV RCX,RAX",
    "0x4011f1: AND RCX,-0x1000",
    "0x4011f8: MOV RDX,RSP",
    "0x4011fb: SUB RDX,RCX",
    "0x4011fe: CMP RSP,RDX",
    "0x401201: JZ 0x00401215",
    "0x401203: SUB RSP,0x1000",
    "0x40120a: OR qword ptr [RSP + 0xff8],0x0",
    "0x401213: JMP 0x004011fe",
    "0x401215: MOV RDX,RAX",
    "0x401218: AND EDX,0xfff",
    "0x40121e: SUB RSP,RDX",
    "0x401221: MOV RDX,RAX",
    "0x401224: AND EDX,0xfff",
    "0x40122a: TEST RDX,RDX",
    "0x40122d: JZ 0x0040123f",
    "0x40122f: AND EAX,0xfff",
    "0x401234: SUB RAX,0x8",
    "0x401238: ADD RAX,RSP",
    "0x40123b: OR qword ptr [RAX],0x0",
    "0x40123f: MOV RAX,RSP",
    "0x401242: ADD RAX,0xf",
    "0x401246: SHR RAX,0x4",
    "0x40124a: SHL RAX,0x4",
    "0x40124e: MOV qword ptr [RBP + -0x10],RAX",
    "0x401252: MOV RAX,qword ptr [RBP + -0x8]",
    "0x401256: MOV qword ptr [RBP + -0x18],RAX",
    "0x40125a: MOV RAX,qword ptr [RBP + -0x18]",
    "0x40125e: MOV byte ptr [RAX],0x0",
    "0x401261: LEA RAX,[RBP + -0x80]",
    "0x401265: MOV EDX,0x63",
    "0x40126a: MOV ESI,0x43",
    "0x40126f: MOV RDI,RAX",
    "0x401272: CALL 0x00401040",
    "0x401277: MOV byte ptr [RBP + -0x1d],0x0",
    "0x40127b: LEA RCX,[RBP + -0x80]",
    "0x40127f: MOV RAX,qword ptr [RBP + -0x18]",
    "0x401283: MOV EDX,0x64",
    "0x401288: MOV RSI,RCX",
    "0x40128b: MOV RDI,RAX",
    "0x40128e: CALL 0x00401050",
    "0x401293: MOV RAX,qword ptr [RBP + -0x18]",
    "0x401297: MOV RDI,RAX",
    "0x40129a: CALL 0x00401030",
    "0x40129f: NOP",
    "0x4012a0: LEAVE",
    "0x4012a1: RET"
  ],
  "calls": [
    "memset",
    "strncat",
    "puts"
  ],
  "tail_jumps": [],
  "constants": [
    "-128",
    "16",
    "1",
    "58",
    "0",
    "-4096",
    "4096",
    "4095",
    "8",
    "15",
    "4",
    "108",
    "99",
    "67",
    "100"
  ],
  "stack_variables": [
    {
      "name": "local_d0",
      "stack_offset": -208,
      "size_bytes": 8,
      "data_type": "undefined8"
    },
    {
      "name": "local_90",
      "stack_offset": -144,
      "size_bytes": 8,
      "data_type": "undefined8"
    },
    {
      "name": "local_88",
      "stack_offset": -136,
      "size_bytes": 1,
      "data_type": "undefined"
    },
    {
      "name": "local_25",
      "stack_offset": -37,
      "size_bytes": 1,
      "data_type": "undefined1"
    },
    {
      "name": "local_20",
      "stack_offset": -32,
      "size_bytes": 8,
      "data_type": "undefined8"
    },
    {
      "name": "local_18",
      "stack_offset": -24,
      "size_bytes": 8,
      "data_type": "undefined8"
    },
    {
      "name": "local_10",
      "stack_offset": -16,
      "size_bytes": 8,
      "data_type": "undefined8"
    }
  ],
  "imports": [
    "memset",
    "strncat",
    "puts"
  ]
}
