{
  "schema_version": "1.0",
  "sample_id": "sample_0232",
  "status": "ok",
  "function": {
    "name": "copy_payload",
    "entry": "0x401156",
    "size_bytes": 169,
    "instruction_count": 43,
    "basic_block_count": 6,
    "body_ranges": [
      [
        "0x401156",
        "0x4011ff"
      ]
    ]
  },
  "decompilation": {
    "status": "ok",
    "text": "\nvoid copy_payload(void)\n\n{\n  undefined1 local_58 [16];\n  undefined1 local_48 [16];\n  undefined8 local_38;\n  uint *local_28;\n  uint *local_20;\n  uint *local_18;\n  ulong local_10;\n  \n  local_18 = (uint *)0x0;\n  local_28 = malloc(10);\n  local_18 = local_28;\n  if (local_28 == (uint *)0x0) {\n                    /* WARNING: Subroutine does not return */\n    exit(-1);\n  }\n  local_58 = (undefined1  [16])0x0;\n  local_48 = (undefined1  [16])0x0;\n  local_38 = 0;\n  for (local_10 = 0; local_10 < 10; local_10 = local_10 + 1) {\n    local_28[local_10] = *(uint *)(local_58 + local_10 * 4);\n  }\n  local_20 = local_28;\n  printf(\"%d\\n\",(ulong)*local_28);\n  free(local_28);\n  return;\n}\n\n",
    "error": null
  },
  "instructions": [
    "0x401156: PUSH RBP",
    "0x401157: MOV RBP,RSP",
    "0x40115a: SUB RSP,0x50",
    "0x40115e: MOV qword ptr [RBP + -0x10],0x0",
    "0x401166: MOV EDI,0xa",
    "0x40116b: CALL 0x00401050",
    "0x401170: MOV qword ptr [RBP + -0x10],RAX",
    "0x401174: CMP qword ptr [RBP + -0x10],0x0",
    "0x401179: JNZ 0x00401185",
    "0x40117b: MOV EDI,0xffffffff",
    "0x401180: CALL 0x00401060",
    "0x401185: MOV RAX,qword ptr [RBP + -0x10]",
    "0x401189: MOV qword ptr [RBP + -0x18],RAX",
    "0x40118d: MOV RAX,qword ptr [RBP + -0x18]",
    "0x401191: MOV qword ptr [RBP + -0x20],RAX",
    "0x401195: PXOR XMM0,XMM0",
    "0x401199: MOVAPS xmmword ptr [RBP + -0x50],XMM0",
    "0x40119d: MOVAPS xmmword ptr [RBP + -0x40],XMM0",
    "0x4011a1: MOVQ qword ptr [RBP + -0x30],XMM0",
    "0x4011a6: MOV qword ptr [RBP + -0x8],0x0",
    "0x4011ae: JMP 0x004011d2",
    "0x4011b0: MOV RAX,qword ptr [RBP + -0x8]",
    "0x4011b4: LEA RDX,[RAX*0x4]",
    "0x4011bc: MOV RAX,qword ptr [RBP + -0x20]",
    "0x4011c0: ADD RDX,RAX",
    "0x4011c3: MOV RAX,qword ptr [RBP + -0x8]",
    "0x4011c7: MOV EAX,dword ptr [RBP + RAX*0x4 + -0x50]",
    "0x4011cb: MOV dword ptr [RDX],EAX",
    "0x4011cd: ADD qword ptr [RBP + -0x8],0x1",
    "0x4011d2: CMP qword ptr [RBP + -0x8],0x9",
    "0x4011d7: JBE 0x004011b0",
    "0x4011d9: MOV RAX,qword ptr [RBP + -0x20]",
    "0x4011dd: MOV EAX,dword ptr [RAX]",
    "0x4011df: MOV ESI,EAX",
    "0x4011e1: MOV EDI,0x402004",
    "0x4011e6: MOV EAX,0x0",
    "0x4011eb: CALL 0x00401040",
    "0x4011f0: MOV RAX,qword ptr [RBP + -0x20]",
    "0x4011f4: MOV RDI,RAX",
    "0x4011f7: CALL 0x00401030",
    "0x4011fc: NOP",
    "0x4011fd: LEAVE",
    "0x4011fe: RET"
  ],
  "calls": [
    "malloc",
    "exit",
    "printf",
    "free"
  ],
  "tail_jumps": [],
  "constants": [
    "80",
    "0",
    "10",
    "-1",
    "1",
    "9"
  ],
  "stack_variables": [
    {
      "name": "local_58",
      "stack_offset": -88,
      "size_bytes": 16,
      "data_type": "undefined1[16]"
    },
    {
      "name": "local_48",
      "stack_offset": -72,
      "size_bytes": 16,
      "data_type": "undefined1[16]"
    },
    {
      "name": "local_38",
      "stack_offset": -56,
      "size_bytes": 8,
      "data_type": "undefined8"
    },
    {
      "name": "local_28",
      "stack_offset": -40,
      "size_bytes": 8,
      "data_type": "undefined8"
    },
    {
      "name": "local_20",
      "stack_offset": -32,
      "size_bytes": 8,
      "data_type": "undefined8"
    },
    {
      "name": "local_18",
      "stack_offset": -24,
      "size_bytes": 8,
      "data_type": "undefined8"
    },
    {
      "name": "local_10",
      "stack_offset": -16,
      "size_bytes": 8,
      "data_type": "undefined8"
    }
  ],
  "imports": [
    "malloc",
    "exit",
    "printf",
    "free"
  ]
}
