{
  "schema_version": "1.0",
  "sample_id": "sample_0282",
  "status": "ok",
  "function": {
    "name": "FUN_00401136",
    "entry": "0x401136",
    "size_bytes": 361,
    "instruction_count": 89,
    "basic_block_count": 11,
    "body_ranges": [
      [
        "0x401136",
        "0x40129f"
      ]
    ]
  },
  "decompilation": {
    "status": "ok",
    "text": "\nvoid FUN_00401136(void)\n\n{\n  undefined8 uVar1;\n  long lVar2;\n  undefined8 *puVar3;\n  undefined1 *puVar4;\n  undefined8 *puVar5;\n  undefined8 local_348 [101];\n  undefined8 *local_20;\n  ulong local_18;\n  undefined8 *local_10;\n  \n  for (puVar3 = local_348; puVar3 != local_348; puVar3 = (undefined8 *)((long)puVar3 + -0x1000)) {\n    *(undefined8 *)((long)puVar3 + -8) = *(undefined8 *)((long)puVar3 + -8);\n  }\n  *(undefined8 *)((long)puVar3 + -8) = *(undefined8 *)((long)puVar3 + -8);\n  local_20 = (undefined8 *)((ulong)((long)puVar3 + -0x191) & 0xfffffffffffffff0);\n  local_10 = local_20;\n  for (puVar4 = (undefined1 *)((long)puVar3 + -0x1a0);\n      puVar4 != (undefined1 *)((long)puVar3 + -0x1a0); puVar4 = puVar4 + -0x1000) {\n    *(undefined8 *)(puVar4 + -8) = *(undefined8 *)(puVar4 + -8);\n  }\n  *(undefined8 *)(puVar4 + -8) = *(undefined8 *)(puVar4 + -8);\n  local_18 = (ulong)(puVar4 + -0x321) & 0xfffffffffffffff0;\n  puVar5 = local_348;\n  for (lVar2 = 100; lVar2 != 0; lVar2 = lVar2 + -1) {\n    *puVar5 = 0;\n    puVar5 = puVar5 + 1;\n  }\n  *(undefined8 *)(puVar4 + -0x338) = 0x401283;\n  memcpy(local_20,local_348,800);\n  uVar1 = *local_20;\n  *(undefined8 *)(puVar4 + -0x338) = 0x40129c;\n  printf(\"%lld\\n\",uVar1);\n  return;\n}\n\n",
    "error": null
  },
  "instructions": [
    "0x401136: PUSH RBP",
    "0x401137: MOV RBP,RSP",
    "0x40113a: SUB RSP,0x340",
    "0x401141: MOV EAX,0x10",
    "0x401146: SUB RAX,0x1",
    "0x40114a: ADD RAX,0x198",
    "0x401150: MOV ESI,0x10",
    "0x401155: MOV EDX,0x0",
    "0x40115a: DIV RSI",
    "0x40115d: IMUL RAX,RAX,0x10",
    "0x401161: MOV RCX,RAX",
    "0x401164: AND RCX,-0x1000",
    "0x40116b: MOV RDX,RSP",
    "0x40116e: SUB RDX,RCX",
    "0x401171: CMP RSP,RDX",
    "0x401174: JZ 0x00401188",
    "0x401176: SUB RSP,0x1000",
    "0x40117d: OR qword ptr [RSP + 0xff8],0x0",
    "0x401186: JMP 0x00401171",
    "0x401188: MOV RDX,RAX",
    "0x40118b: AND EDX,0xfff",
    "0x401191: SUB RSP,RDX",
    "0x401194: MOV RDX,RAX",
    "0x401197: AND EDX,0xfff",
    "0x40119d: TEST RDX,RDX",
    "0x4011a0: JZ 0x004011b2",
    "0x4011a2: AND EAX,0xfff",
    "0x4011a7: SUB RAX,0x8",
    "0x4011ab: ADD RAX,RSP",
    "0x4011ae: OR qword ptr [RAX],0x0",
    "0x4011b2: MOV RAX,RSP",
    "0x4011b5: ADD RAX,0xf",
    "0x4011b9: SHR RAX,0x4",
    "0x4011bd: SHL RAX,0x4",
    "0x4011c1: MOV qword ptr [RBP + -0x8],RAX",
    "0x4011c5: MOV EAX,0x10",
    "0x4011ca: SUB RAX,0x1",
    "0x4011ce: ADD RAX,0x328",
    "0x4011d4: MOV ESI,0x10",
    "0x4011d9: MOV EDX,0x0",
    "0x4011de: DIV RSI",
    "0x4011e1: IMUL RAX,RAX,0x10",
    "0x4011e5: MOV RCX,RAX",
    "0x4011e8: AND RCX,-0x1000",
    "0x4011ef: MOV RDX,RSP",
    "0x4011f2: SUB RDX,RCX",
    "0x4011f5: CMP RSP,RDX",
    "0x4011f8: JZ 0x0040120c",
    "0x4011fa: SUB RSP,0x1000",
    "0x401201: OR qword ptr [RSP + 0xff8],0x0",
    "0x40120a: JMP 0x004011f5",
    "0x40120c: MOV RDX,RAX",
    "0x40120f: AND EDX,0xfff",
    "0x401215: SUB RSP,RDX",
    "0x401218: MOV RDX,RAX",
    "0x40121b: AND EDX,0xfff",
    "0x401221: TEST RDX,RDX",
    "0x401224: JZ 0x00401236",
    "0x401226: AND EAX,0xfff",
    "0x40122b: SUB RAX,0x8",
    "0x40122f: ADD RAX,RSP",
    "0x401232: OR qword ptr [RAX],0x0",
    "0x401236: MOV RAX,RSP",
    "0x401239: ADD RAX,0xf",
    "0x40123d: SHR RAX,0x4",
    "0x401241: SHL RAX,0x4",
    "0x401245: MOV qword ptr [RBP + -0x10],RAX",
    "0x401249: MOV RAX,qword ptr [RBP + -0x8]",
    "0x40124d: MOV qword ptr [RBP + -0x18],RAX",
    "0x401251: LEA RDX,[RBP + -0x340]",
    "0x401258: MOV EAX,0x0",
    "0x40125d: MOV ECX,0x64",
    "0x401262: MOV RDI,RDX",
    "0x401265: STOSQ.REP RDI",
    "0x401268: LEA RCX,[RBP + -0x340]",
    "0x40126f: MOV RAX,qword ptr [RBP + -0x18]",
    "0x401273: MOV EDX,0x320",
    "0x401278: MOV RSI,RCX",
    "0x40127b: MOV RDI,RAX",
    "0x40127e: CALL 0x00401040",
    "0x401283: MOV RAX,qword ptr [RBP + -0x18]",
    "0x401287: MOV RAX,qword ptr [RAX]",
    "0x40128a: MOV RSI,RAX",
    "0x40128d: MOV EDI,0x402004",
    "0x401292: MOV EAX,0x0",
    "0x401297: CALL 0x00401030",
    "0x40129c: NOP",
    "0x40129d: LEAVE",
    "0x40129e: RET"
  ],
  "calls": [
    "memcpy",
    "printf"
  ],
  "tail_jumps": [],
  "constants": [
    "832",
    "16",
    "1",
    "408",
    "0",
    "-4096",
    "4096",
    "4095",
    "8",
    "15",
    "4",
    "808",
    "100",
    "800"
  ],
  "stack_variables": [
    {
      "name": "local_4f0",
      "stack_offset": -1264,
      "size_bytes": 8,
      "data_type": "undefined8"
    },
    {
      "name": "local_350",
      "stack_offset": -848,
      "size_bytes": 8,
      "data_type": "undefined8"
    },
    {
      "name": "local_348",
      "stack_offset": -840,
      "size_bytes": 1,
      "data_type": "undefined"
    },
    {
      "name": "local_20",
      "stack_offset": -32,
      "size_bytes": 8,
      "data_type": "undefined8"
    },
    {
      "name": "local_18",
      "stack_offset": -24,
      "size_bytes": 8,
      "data_type": "undefined8"
    },
    {
      "name": "local_10",
      "stack_offset": -16,
      "size_bytes": 8,
      "data_type": "undefined8"
    }
  ],
  "imports": [
    "memcpy",
    "printf"
  ]
}
