{
  "schema_version": "1.0",
  "sample_id": "sample_0140",
  "status": "ok",
  "function": {
    "name": "FUN_00401136",
    "entry": "0x401136",
    "size_bytes": 213,
    "instruction_count": 55,
    "basic_block_count": 6,
    "body_ranges": [
      [
        "0x401136",
        "0x40120b"
      ]
    ]
  },
  "decompilation": {
    "status": "ok",
    "text": "\nvoid FUN_00401136(void)\n\n{\n  uint uVar1;\n  undefined1 *puVar2;\n  undefined1 local_38 [16];\n  undefined1 local_28 [16];\n  undefined8 local_18;\n  uint *local_10;\n  \n  local_10 = (uint *)0x0;\n  for (puVar2 = local_38; puVar2 != local_38; puVar2 = puVar2 + -0x1000) {\n    *(undefined8 *)(puVar2 + -8) = *(undefined8 *)(puVar2 + -8);\n  }\n  *(undefined8 *)(puVar2 + -8) = *(undefined8 *)(puVar2 + -8);\n  local_38 = (undefined1  [16])0x0;\n  local_28 = (undefined1  [16])0x0;\n  local_18 = 0;\n  local_10 = (uint *)((ulong)(puVar2 + -0x21) & 0xfffffffffffffff0);\n  *(undefined8 *)(puVar2 + -0x38) = 0x4011f1;\n  memcpy((uint *)((ulong)(puVar2 + -0x21) & 0xfffffffffffffff0),local_38,0x28);\n  uVar1 = *local_10;\n  *(undefined8 *)(puVar2 + -0x38) = 0x401208;\n  printf(\"%d\\n\",(ulong)uVar1);\n  return;\n}\n\n",
    "error": null
  },
  "instructions": [
    "0x401136: PUSH RBP",
    "0x401137: MOV RBP,RSP",
    "0x40113a: SUB RSP,0x30",
    "0x40113e: MOV qword ptr [RBP + -0x8],0x0",
    "0x401146: MOV EAX,0x10",
    "0x40114b: SUB RAX,0x1",
    "0x40114f: ADD RAX,0x30",
    "0x401153: MOV ESI,0x10",
    "0x401158: MOV EDX,0x0",
    "0x40115d: DIV RSI",
    "0x401160: IMUL RAX,RAX,0x10",
    "0x401164: MOV RCX,RAX",
    "0x401167: AND RCX,-0x1000",
    "0x40116e: MOV RDX,RSP",
    "0x401171: SUB RDX,RCX",
    "0x401174: CMP RSP,RDX",
    "0x401177: JZ 0x0040118b",
    "0x401179: SUB RSP,0x1000",
    "0x401180: OR qword ptr [RSP + 0xff8],0x0",
    "0x401189: JMP 0x00401174",
    "0x40118b: MOV RDX,RAX",
    "0x40118e: AND EDX,0xfff",
    "0x401194: SUB RSP,RDX",
    "0x401197: MOV RDX,RAX",
    "0x40119a: AND EDX,0xfff",
    "0x4011a0: TEST RDX,RDX",
    "0x4011a3: JZ 0x004011b5",
    "0x4011a5: AND EAX,0xfff",
    "0x4011aa: SUB RAX,0x8",
    "0x4011ae: ADD RAX,RSP",
    "0x4011b1: OR qword ptr [RAX],0x0",
    "0x4011b5: MOV RAX,RSP",
    "0x4011b8: ADD RAX,0xf",
    "0x4011bc: SHR RAX,0x4",
    "0x4011c0: SHL RAX,0x4",
    "0x4011c4: MOV qword ptr [RBP + -0x8],RAX",
    "0x4011c8: PXOR XMM0,XMM0",
    "0x4011cc: MOVAPS xmmword ptr [RBP + -0x30],XMM0",
    "0x4011d0: MOVAPS xmmword ptr [RBP + -0x20],XMM0",
    "0x4011d4: MOVQ qword ptr [RBP + -0x10],XMM0",
    "0x4011d9: LEA RCX,[RBP + -0x30]",
    "0x4011dd: MOV RAX,qword ptr [RBP + -0x8]",
    "0x4011e1: MOV EDX,0x28",
    "0x4011e6: MOV RSI,RCX",
    "0x4011e9: MOV RDI,RAX",
    "0x4011ec: CALL 0x00401040",
    "0x4011f1: MOV RAX,qword ptr [RBP + -0x8]",
    "0x4011f5: MOV EAX,dword ptr [RAX]",
    "0x4011f7: MOV ESI,EAX",
    "0x4011f9: MOV EDI,0x402004",
    "0x4011fe: MOV EAX,0x0",
    "0x401203: CALL 0x00401030",
    "0x401208: NOP",
    "0x401209: LEAVE",
    "0x40120a: RET"
  ],
  "calls": [
    "memcpy",
    "printf"
  ],
  "tail_jumps": [],
  "constants": [
    "48",
    "0",
    "16",
    "1",
    "-4096",
    "4096",
    "4095",
    "8",
    "15",
    "4",
    "40"
  ],
  "stack_variables": [
    {
      "name": "local_40",
      "stack_offset": -64,
      "size_bytes": 8,
      "data_type": "undefined8"
    },
    {
      "name": "local_38",
      "stack_offset": -56,
      "size_bytes": 16,
      "data_type": "undefined1[16]"
    },
    {
      "name": "local_28",
      "stack_offset": -40,
      "size_bytes": 16,
      "data_type": "undefined1[16]"
    },
    {
      "name": "local_18",
      "stack_offset": -24,
      "size_bytes": 8,
      "data_type": "undefined8"
    },
    {
      "name": "local_10",
      "stack_offset": -16,
      "size_bytes": 8,
      "data_type": "undefined8"
    }
  ],
  "imports": [
    "memcpy",
    "printf"
  ]
}
