{
  "schema_version": "1.0",
  "sample_id": "sample_0302",
  "status": "ok",
  "function": {
    "name": "copy_payload",
    "entry": "0x401146",
    "size_bytes": 377,
    "instruction_count": 91,
    "basic_block_count": 11,
    "body_ranges": [
      [
        "0x401146",
        "0x4012bf"
      ]
    ]
  },
  "decompilation": {
    "status": "ok",
    "text": "\nvoid copy_payload(void)\n\n{\n  wchar_t *pwVar1;\n  undefined1 *puVar2;\n  wchar_t local_1b8 [99];\n  undefined4 local_2c;\n  wchar_t *local_20;\n  wchar_t *local_18;\n  ulong local_10;\n  \n  for (pwVar1 = local_1b8; pwVar1 != local_1b8; pwVar1 = (wchar_t *)((long)pwVar1 + -0x1000)) {\n    *(undefined8 *)((long)pwVar1 + -8) = *(undefined8 *)((long)pwVar1 + -8);\n  }\n  *(undefined8 *)((long)pwVar1 + -8) = *(undefined8 *)((long)pwVar1 + -8);\n  local_10 = (ulong)((long)pwVar1 + -0xc1) & 0xfffffffffffffff0;\n  for (puVar2 = (undefined1 *)((long)pwVar1 + -0xd0); puVar2 != (undefined1 *)((long)pwVar1 + -0xd0)\n      ; puVar2 = puVar2 + -0x1000) {\n    *(undefined8 *)(puVar2 + -8) = *(undefined8 *)(puVar2 + -8);\n  }\n  *(undefined8 *)(puVar2 + -8) = *(undefined8 *)(puVar2 + -8);\n  local_20 = (wchar_t *)((ulong)(puVar2 + -0x191) & 0xfffffffffffffff0);\n  *local_20 = L'\\0';\n  *(undefined8 *)(puVar2 + -0x1a8) = 0x401284;\n  local_18 = local_20;\n  wmemset(local_1b8,L'C',99);\n  local_2c = 0;\n  *(undefined8 *)(puVar2 + -0x1a8) = 0x4012a6;\n  wcsncat(local_20,local_1b8,100);\n  *(undefined8 *)(puVar2 + -0x1a8) = 0x4012bc;\n  wprintf(L\"%ls\\n\",local_20);\n  return;\n}\n\n",
    "error": null
  },
  "instructions": [
    "0x401146: PUSH RBP",
    "0x401147: MOV RBP,RSP",
    "0x40114a: SUB RSP,0x1b0",
    "0x401151: MOV EAX,0x10",
    "0x401156: SUB RAX,0x1",
    "0x40115a: ADD RAX,0xd0",
    "0x401160: MOV ESI,0x10",
    "0x401165: MOV EDX,0x0",
    "0x40116a: DIV RSI",
    "0x40116d: IMUL RAX,RAX,0x10",
    "0x401171: MOV RCX,RAX",
    "0x401174: AND RCX,-0x1000",
    "0x40117b: MOV RDX,RSP",
    "0x40117e: SUB RDX,RCX",
    "0x401181: CMP RSP,RDX",
    "0x401184: JZ 0x00401198",
    "0x401186: SUB RSP,0x1000",
    "0x40118d: OR qword ptr [RSP + 0xff8],0x0",
    "0x401196: JMP 0x00401181",
    "0x401198: MOV RDX,RAX",
    "0x40119b: AND EDX,0xfff",
    "0x4011a1: SUB RSP,RDX",
    "0x4011a4: MOV RDX,RAX",
    "0x4011a7: AND EDX,0xfff",
    "0x4011ad: TEST RDX,RDX",
    "0x4011b0: JZ 0x004011c2",
    "0x4011b2: AND EAX,0xfff",
    "0x4011b7: SUB RAX,0x8",
    "0x4011bb: ADD RAX,RSP",
    "0x4011be: OR qword ptr [RAX],0x0",
    "0x4011c2: MOV RAX,RSP",
    "0x4011c5: ADD RAX,0xf",
    "0x4011c9: SHR RAX,0x4",
    "0x4011cd: SHL RAX,0x4",
    "0x4011d1: MOV qword ptr [RBP + -0x8],RAX",
    "0x4011d5: MOV EAX,0x10",
    "0x4011da: SUB RAX,0x1",
    "0x4011de: ADD RAX,0x198",
    "0x4011e4: MOV EDI,0x10",
    "0x4011e9: MOV EDX,0x0",
    "0x4011ee: DIV RDI",
    "0x4011f1: IMUL RAX,RAX,0x10",
    "0x4011f5: MOV RCX,RAX",
    "0x4011f8: AND RCX,-0x1000",
    "0x4011ff: MOV RDX,RSP",
    "0x401202: SUB RDX,RCX",
    "0x401205: CMP RSP,RDX",
    "0x401208: JZ 0x0040121c",
    "0x40120a: SUB RSP,0x1000",
    "0x401211: OR qword ptr [RSP + 0xff8],0x0",
    "0x40121a: JMP 0x00401205",
    "0x40121c: MOV RDX,RAX",
    "0x40121f: AND EDX,0xfff",
    "0x401225: SUB RSP,RDX",
    "0x401228: MOV RDX,RAX",
    "0x40122b: AND EDX,0xfff",
    "0x401231: TEST RDX,RDX",
    "0x401234: JZ 0x00401246",
    "0x401236: AND EAX,0xfff",
    "0x40123b: SUB RAX,0x8",
    "0x40123f: ADD RAX,RSP",
    "0x401242: OR qword ptr [RAX],0x0",
    "0x401246: MOV RAX,RSP",
    "0x401249: ADD RAX,0xf",
    "0x40124d: SHR RAX,0x4",
    "0x401251: SHL RAX,0x4",
    "0x401255: MOV qword ptr [RBP + -0x10],RAX",
    "0x401259: MOV RAX,qword ptr [RBP + -0x10]",
    "0x40125d: MOV qword ptr [RBP + -0x18],RAX",
    "0x401261: MOV RAX,qword ptr [RBP + -0x18]",
    "0x401265: MOV dword ptr [RAX],0x0",
    "0x40126b: LEA RAX,[RBP + -0x1b0]",
    "0x401272: MOV EDX,0x63",
    "0x401277: MOV ESI,0x43",
    "0x40127c: MOV RDI,RAX",
    "0x40127f: CALL 0x00401040",
    "0x401284: MOV dword ptr [RBP + -0x24],0x0",
    "0x40128b: LEA RCX,[RBP + -0x1b0]",
    "0x401292: MOV RAX,qword ptr [RBP + -0x18]",
    "0x401296: MOV EDX,0x64",
    "0x40129b: MOV RSI,RCX",
    "0x40129e: MOV RDI,RAX",
    "0x4012a1: CALL 0x00401030",
    "0x4012a6: MOV RAX,qword ptr [RBP + -0x18]",
    "0x4012aa: MOV RSI,RAX",
    "0x4012ad: MOV EDI,0x402004",
    "0x4012b2: MOV EAX,0x0",
    "0x4012b7: CALL 0x00401050",
    "0x4012bc: NOP",
    "0x4012bd: LEAVE",
    "0x4012be: RET"
  ],
  "calls": [
    "wmemset",
    "wcsncat",
    "wprintf"
  ],
  "tail_jumps": [],
  "constants": [
    "432",
    "16",
    "1",
    "208",
    "0",
    "-4096",
    "4096",
    "4095",
    "8",
    "15",
    "4",
    "408",
    "99",
    "67",
    "100"
  ],
  "stack_variables": [
    {
      "name": "local_290",
      "stack_offset": -656,
      "size_bytes": 8,
      "data_type": "undefined8"
    },
    {
      "name": "local_1c0",
      "stack_offset": -448,
      "size_bytes": 8,
      "data_type": "undefined8"
    },
    {
      "name": "local_1b8",
      "stack_offset": -440,
      "size_bytes": 1,
      "data_type": "undefined"
    },
    {
      "name": "local_2c",
      "stack_offset": -44,
      "size_bytes": 4,
      "data_type": "undefined4"
    },
    {
      "name": "local_20",
      "stack_offset": -32,
      "size_bytes": 8,
      "data_type": "undefined8"
    },
    {
      "name": "local_18",
      "stack_offset": -24,
      "size_bytes": 8,
      "data_type": "undefined8"
    },
    {
      "name": "local_10",
      "stack_offset": -16,
      "size_bytes": 8,
      "data_type": "undefined8"
    }
  ],
  "imports": [
    "wmemset",
    "wcsncat",
    "wprintf"
  ]
}
